<!ELEMENT Automania (Category+)>
<!ELEMENT Category (Name,Price,Quantity)>
<!ELEMENT Name (#PCDATA)>
<!ELEMENT Price (#PCDATA)>
<!ELEMENT Quantity (#PCDATA)>